ID,houseLoc,longitude,latitude,unitPrice,housePrice,houseArea,houseBedroom,houseRoom,houseOrientation,houseAge
1,雨花体育新城劳动东路821号明昇壹城,113.0482899378384,28.162047083440488,13767,125,90.8,3,6,南,6.0
2,岳麓梅溪湖南近湖七路32号卓越浅水湾,112.88026936162778,28.17907538234886,13267,125,94.22,3,6,南,7.0
3,岳麓保利麓谷林语桐梓坡西路408号保利麓谷林语,112.87029353087469,28.225633095467604,10476,140,133.64,4,8,南北,11.0
4,岳麓金星北路西二环与华安路交汇处龙湖舜山府,112.91979230320408,28.249971210668896,15487,175,113,3,7,南,
5,岳麓梅溪湖北东方红路288号旭辉御府,112.86381773264083,28.193063602033256,11967,115,96.1,3,6,南,11.0
6,"岳麓市政府杜鹃路,近杜容路盛世耀凯",112.93343582500219,28.23176683571211,10063,129.8,129,3,7,南北,5.0
7,岳麓市政府杜鹃路858号奥克斯缔壹城,112.91008985494562,28.236648224037804,10018,108,107.81,3,7,南北,6.0
8,岳麓观沙岭北二环与金星路交汇处东北角万科森林公园,112.93382641791081,28.26162603199086,14000,161,115,3,7,南,
9,天心省政府黑石铺路北辰中央公园(CDEF区),112.96747898901344,28.10304148664344,10097,130.8,129.55,4,8,南,10.0
10,岳麓梅溪湖北东方红路梅溪青秀(三期),112.87042618462176,28.19248321237245,14448,200,138.43,4,8,南北,9.0
11,开福万科城福元西路珠江好世界,112.98894669023812,28.255555069101295,13211,123,93.11,3,6,南北,7.0
12,雨花井湾子湘府东路一段986号远洋红星长沙天铂,113.04085384864604,28.123878194908315,10286,108,105,3,7,南,
13,岳麓梅溪湖北东方红南路369号梅溪鑫苑名家,112.8594533294405,28.192637375830156,12228,130,106.32,3,7,南北,7.0
14,雨花体育新城长沙大道789号阳光城尚东湾,113.05398716735706,28.176999997845513,11184,114,101.94,3,6,南北,4.0
15,雨花体育新城劳动东路1299号万科魅力之城,113.06379725810265,28.16598919398763,12659,135,106.65,3,7,东,11.0
16,岳麓金星北路金星路与长望路交会处越秀栖山悦府,112.94309974543047,28.221427859440308,13493,170,126,4,8,南,
17,芙蓉火车站紫薇路386号省人民检察院住宅区,113.01923876951996,28.213254194374496,10086,118,117,3,7,南北,15.0
18,岳麓梅溪湖南梅溪湖路276号梅溪湖金茂湾(一期),112.88016344550466,28.183523602322737,13825,195.8,141.63,4,8,南北,6.0
19,雨花高桥马王堆南路79号西子花苑,113.02132261890893,28.184233117320726,9102,124.9,137.21,3,7,南北,15.0
20,望城望城新区政府普瑞大道与沿河路交汇处澳海望洲府(新房),112.85035851211578,28.29824447261247,6989,124,177.44,5,10,南,
21,雨花时代阳光大道万家丽南路一段226号恒生碧水龙庭,113.02797697303492,28.090357023595363,12978,108,83.22,3,6,南北,11.0
22,望城月亮岛月亮岛路越秀湘江星汇城(一期),112.92611912196683,28.29359944262652,11390,158,138.72,4,8,南北,5.0
23,岳麓雷锋大道排山路以南，颐和路以西和立谷山悦,112.88911297599253,28.24281774090533,8632,115,133.23,4,8,南,
24,岳麓市政府谷丰南路419号湘腾琴岛,112.92155230238495,28.219172434557077,13125,109,83.05,3,6,南北,6.0
25,雨花井湾子井湾路458号中建桂苑金桂苑,113.01019431359194,28.128443389544543,8908,125.8,141.23,4,8,南北,18.0
26,岳麓洋湖湿地公园许家洲路106号兰亭湾畔(一期),112.94132186874053,28.13980082663927,12578,155,123.24,4,8,南,7.0
27,岳麓洋湖湿地公园长湾路36号奥克斯滨仕花园,112.94121886441825,28.134988344234877,12427,145,116.69,3,7,南,7.0
28,岳麓洋湖湿地公园虹山路与潇湘南大道交汇处保利长交锦上,112.92232523185505,28.12961884091196,12477,131,105,3,7,南,
29,雨花体育新城万家丽中路2段345号金石雅苑,113.02838234725894,28.148010231794167,10117,132,130.48,3,7,南北,10.0
30,"星沙开元路东三路,近望仙东路华润凤凰城(三期)",113.08945244386095,28.252969480800825,11127,129.8,116.66,3,7,南北,11.0
31,"岳麓洋湖湿地公园许家洲路,近联丰路兰亭湾畔(二期)",112.9352442229509,28.131543357388626,11306,145,128.26,4,8,南,6.0
32,开福湘江世纪城湘江北路湘江世纪城咏江苑,112.97305973922425,28.263124694229052,10614,105,98.93,3,6,南北,13.0
33,星沙万家丽北路万家丽北路88号山水湾,113.04891506789966,28.27241940866246,10814,136,125.77,3,7,南北,9.0
34,开福广电中心星沙联络线与万家丽路交汇处日盛湖湘悦府(新房),113.06791931623887,28.323956633447587,9483,110,116,3,7,南,
35,岳麓洋湖湿地公园坪塘大道299号万科白鹭郡,112.93179630773253,28.135901377937465,14438,188,130.22,4,8,南,9.0
36,天心天心区政府芙蓉南路二段88号绿地公馆,112.98136133696833,28.106132332582245,13327,127,95.3,3,7,南,11.0
37,岳麓梅溪湖北映日路振业城(三期),112.8938333966829,28.204407209504534,15002,132,87.99,3,6,南,5.0
38,岳麓雷锋大道谷苑路与汇智路交会处百世云境,112.82473349611736,28.214283151429523,12234,126,103,3,7,南,
39,岳麓麓谷文轩路579号天元涉外景园,112.87200230763526,28.21072660472397,11266,106,94.09,3,7,南,6.0
40,岳麓观沙岭潇湘北路三段959号万科里金域滨江,112.95622789966932,28.240414176838893,16785,157,93.54,3,6,南北,8.0
41,天心省政府新韶西路288号鑫远御文台,112.96556965581753,28.125776117550004,10717,142,132.5,4,8,南北,8.0
42,长沙县长沙县周边福元路与山月路交汇处保利开福双盘和光北中心,113.0444976510861,28.27158250645132,11575,125,108,3,7,南,
43,开福松桂园蔡锷北路司马里小区,112.97726501786693,28.2069118556518,10852,102,94,3,5,南北,25.0
44,岳麓湖南财专谷丰南路9号高信向日葵,112.92064906715356,28.214238027794202,14003,135,96.41,3,7,南北,11.0
45,雨花井湾子井湾路17号城南故事,113.00955082595404,28.12555990013859,10491,94.6,90.18,3,7,南,13.0
46,岳麓麓谷谷苑路与雷高路交汇处长沙溪山悦,112.88374729868804,28.222784438097996,11273,124,110,3,7,南,
47,开福广电中心万家丽北路一段699号恒大雅苑,113.03904121715944,28.24911168366689,9549,138,144.53,3,7,南北,10.0
48,天心仰天湖轻院路141号钱隆首府,112.97554949204515,28.172736420067906,12366,129,104.32,3,7,南北,11.0
49,岳麓银盆岭岳麓大道保利天禧(D区),112.95599288538443,28.228030231424125,14964,139,92.89,3,6,南,4.0
50,岳麓银盆岭银杉路31号绿地中央广场,112.94559247968398,28.229983041911147,11157,110,98.6,3,6,南北,10.0
51,望城月亮岛银杉路与月亮岛路交叉路口往南约160米金富湘江悦城(新房),112.92432253343117,28.289884158169286,11299,127,112.4,3,6,南,
52,芙蓉汽车东站桐西路辉煌国际城(二期),113.04119147417664,28.20783831739007,10529,95,90.23,3,6,南,13.0
53,岳麓市政府观沙路八方小区(C区),112.94054048064805,28.241575257788643,32477,403,124.09,3,7,南,8.0
54,雨花左家塘车站南路171号芒果雅苑,113.00322670929648,28.168078900005394,10063,119.8,119.05,3,7,南北,7.0
55,天心大托铺机场口天心大道与老甫冲路交汇处招商蛇口璀璨学府,112.93149598642658,28.084010099469424,11316,129,114,3,7,南,
56,岳麓观沙岭潇湘北路三段668号中铁西江悦,112.95160808754675,28.25869760334707,13592,139.8,102.86,3,7,南,10.0
57,岳麓梅溪湖北环湖路919号中建梅溪湖中心,112.89043589878924,28.1954386484808,14913,187,125.4,4,8,南北,7.0
58,岳麓雷锋大道岳麓大道金辉优步花园,112.89664921242453,28.229760940066484,9231,120,130,3,7,南北,5.0
59,望城金星北金星北路与月亮岛路交会处东北角明发阅江悦府三期,112.91590790228567,28.292225247748483,7782,120,154.21,5,9,南,
60,雨花高桥东二环长建市场,113.01132752745231,28.18248035863798,7156,67,93.64,3,6,南,34.0
61,岳麓梅溪湖南梅溪湖路佳兆业云顶梅溪湖(六期),112.8842212597481,28.180943071662863,13866,198,142.8,4,8,南北,7.0
62,岳麓银盆岭咸嘉湖路216号蓝光雍锦阁,112.94481174620407,28.21508637443355,11883,128,107.72,3,7,南北,10.0
63,雨花左家塘曙光中路东方新世界,112.99669202635289,28.179857111950092,11421,155,135.72,4,8,南北,29.0
64,星沙开元路东四路中建悦和城,113.09874673046025,28.252801049730454,8462,110,130,4,8,南,4.0
65,天心新开铺木莲西路168号水墨林溪,112.99076201386973,28.131162083504012,10318,130,126,3,7,南,9.0
66,芙蓉汽车东站农园路恒大江湾,113.04547389045113,28.207751038176156,9873,125,126.62,3,7,南北,8.0
67,天心暮云万家丽南路二段989号丽发新城(新房),113.01458159758431,28.064522781702408,8985,129,143.58,5,9,南,
68,"芙蓉人民东路人民东路,近望龙路中交中央公园",113.06076840609892,28.192508520092485,12809,149.8,116.95,3,7,南,3.0
69,岳麓银盆岭岳麓大道57号奥克斯中央公馆,112.950143109979,28.226334354631476,12912,139,107.66,3,7,南北,8.0
70,雨花雨花区政府圭塘路228号香樟兰亭,113.02148465498172,28.141527884835284,11627,103.8,89.28,3,7,南,10.0
71,岳麓市政府观沙路八方小区(B区),112.9340006098054,28.24273580525206,30689,388,126.43,3,7,南北,5.0
72,芙蓉万家丽晚报大道518号佳兆业时代广场,113.03067559163351,28.21161684684018,12691,116.8,92.04,3,6,南,8.0
73,"岳麓观沙岭潇湘北路,近安居路万科里金域国际(一二期)",112.9553281639349,28.234267536712643,17939,198,110.38,3,7,南,8.0
74,雨花桂花公园曙光中路302号长房天翼未来城,112.99425296094988,28.174829158668757,11093,148,133.42,3,7,南北,9.0
75,"雨花万家丽南路汇金路,近黄谷路金地铂悦",113.00737434478017,28.082931667418972,11465,150,130.84,4,8,南,4.0
76,岳麓枫林三路枫林三路859号弘德好莱城,112.87163621276645,28.198010818565567,10479,95,90.66,3,6,南,9.0
77,"雨花汽车南站韶山南路,近汇金路中海珑悦府",113.00408483515714,28.092867734725417,12077,140,115.93,3,7,南,3.0
78,岳麓银盆岭汉陵巷山水誉峰,112.94542755598853,28.21818648642809,11803,135.5,114.81,3,6,南北,11.0
79,开福广电中心洪山路188号藏珑湖上国际花园,113.02824015289721,28.24307569237787,11635,168,144.4,4,8,南北,10.0
80,岳麓雷锋大道岳麓西大道158号长房云时代,112.88932085100843,28.23042208100394,11741,138,117.54,3,7,南北,6.0
81,望城玫瑰园金星北路208号时代倾城(二期),112.9286134222206,28.2809405565727,10215,118,115.52,4,8,南,8.0
82,岳麓桐梓坡白鹤咀街99号公园里,112.92668989528839,28.218487295891773,12257,169.8,138.54,3,7,南北,8.0
83,岳麓麓谷麓枫路59号麓谷E家人,112.89591612015917,28.21303634320191,9362,115,122.85,3,7,南北,16.0
84,岳麓麓谷嘉运路中冶中央公园,112.84892006332501,28.22143081771175,11216,126,112.34,3,7,南北,6.0
85,开福北辰三角洲黄兴北路1302号北辰三角洲C3区,112.98130873640076,28.242269462664996,14790,167,112.92,3,6,南北,3.0
86,"望城月亮岛银杉路,近普瑞大道勤诚达境界城",112.91798763820691,28.29473348700244,10223,127.8,125.02,4,8,南北,6.0
87,天心浦沅芙蓉中路三段600号钱隆樽品,112.96781260035675,28.187343497800192,10509,123,117.05,3,7,南,10.0
88,岳麓观沙岭含光路77号恒大御景湾,112.9527391202999,28.240144854480345,14067,198,140.76,3,7,南北,6.0
89,岳麓观沙岭茶子山东路166号协信星澜汇,112.94922804065762,28.245522773651956,13968,198,141.76,4,8,南,9.0
90,岳麓湖南财专金星中路199号佳兴格林星城,112.92558376857981,28.214493293597393,10417,135,129.6,3,7,南北,12.0
91,天心天心区政府芙蓉南路鑫远翡丽郡,112.98358717844035,28.108528308120306,13787,120,87.04,3,6,南,4.0
92,开福湘江世纪城双湾路69号双湾国际,112.97102440788788,28.278115649437083,10532,110,104.45,3,7,南北,8.0
93,岳麓咸嘉新村桐梓坡路519号高鑫麓城,112.92120600995285,28.220775620310928,13762,168,122.08,3,7,南,16.0
94,雨花时代阳光大道联圭路169号中建嘉和城,113.04426739954363,28.09438445520352,11049,106,95.94,3,6,南北,5.0
95,岳麓市政府茶子山路19号新兴北京御园(一期),112.9267787691052,28.242915872220166,13572,165,121.58,4,8,南,9.0
96,天心金盆岭赤岭路215号通用时代国际社区,112.97368812841435,28.152935759806777,13445,185,137.6,3,7,南北,7.0
97,芙蓉万家丽万家丽中路一段112号东方新城,113.02423033092744,28.192865683048925,7917,83,104.85,3,7,东南,23.0
98,岳麓梅溪湖南环湖路中海梅溪湖壹号(二期),112.89514124242015,28.190431746341183,16067,186,115.77,3,7,南北,7.0
99,雨花体育新城沙湾路9号半山壹号,113.03965308879971,28.157141156906107,11190,157,140.31,3,7,南北,5.0
100,雨花汽车南站汇金路288号五矿万境蓝山,113.00297653247135,28.08191660446729,10325,150,145.28,4,8,南,7.0
101,岳麓市政府金星北路二段89号岳麓恒大华府,112.92664267940926,28.247899910798125,16031,145,90.45,3,6,南,10.0
102,芙蓉芙蓉区政府人民东路329号湘域熙岸,113.03672766098853,28.18889263728156,13654,125,91.55,2,5,南,10.0
103,"岳麓洋湖湿地公园先导路,近湘浦路中海阅江府",112.92232523185505,28.12961884091196,19924,235,117.95,3,7,南,4.0
104,"岳麓麓谷东方红路,近文轩路万科金色梦想",112.85557921303044,28.21109265907843,13641,186,136.36,4,8,南北,2.0
105,岳麓梅溪湖南梅溪湖路梅溪湖金茂湾(二期),112.8782763413861,28.179740817879583,13887,200,144.02,4,8,南北,6.0
106,岳麓梅溪湖北麓云路268号梅溪湖金茂悦(三期),112.88802610119005,28.19795740998396,13726,145,105.64,3,7,南,8.0
107,雨花赤岗冲车站南路175号福乐康城,113.0035681432833,28.165651956096006,8149,106,130.09,3,7,南,21.0
108,"岳麓梅溪湖北映日路,近雪松路南山梅溪一方",112.87005753268575,28.185823770062797,12483,150,120.17,3,7,南,3.0
109,开福四方坪陡岭路180号瑞都豪庭,112.991711553257,28.237474540864337,9247,80,86.52,3,6,南北,11.0
110,开福湘江世纪城湘江北路湘江世纪城临江苑,112.96873118439615,28.270538848115912,10597,150,141.55,4,8,南北,12.0
111,岳麓梅溪湖北麓松路239号嘉和城,112.86698391385345,28.19590389627908,10190,98,96.18,3,7,南,8.0
112,岳麓梅溪湖南梅溪湖路万科里梅溪郡(一期),112.89547475079443,28.18724104864428,20962,205,97.8,3,6,东南,7.0
113,岳麓长郡双语中学佑母塘路799号钰龙天下佳园(二期),112.92980205360574,28.251463012797977,23788,230,96.69,3,6,南,8.0
114,岳麓市政府岳麓大道355号西城龙庭,112.92677107203741,28.227736161742904,12509,168,134.31,4,8,南北,14.0
115,"岳麓梅溪湖北映日路,近东方红路建发央著",112.87286846796918,28.188197368110313,17370,175,100.75,3,7,南,6.0
116,岳麓银盆岭潇湘中路万科里金域国际(三期),112.95666405509945,28.237682282271578,23915,330,137.99,4,8,南,4.0
117,岳麓阳光100南二环518号阳光100后海,112.93004178054133,28.14650600499907,9276,128,138,3,7,南,10.0
118,岳麓雷锋大道雷锋大道36号宜居莱茵城,112.90322086448646,28.231852612198292,11550,103,89.18,3,6,南北,14.0
119,岳麓桐梓坡桐梓坡路579号谋房博客,112.91592817039397,28.221967438457764,12062,145,120.22,4,7,南北,12.0
120,星沙万家丽北路湘龙西路42号保利香槟国际,113.07430507216695,28.236378226700776,8735,111.8,128,4,8,南,4.0
121,望城月亮岛金星北路三段399号南山苏迪亚诺(别墅),112.90845295415289,28.295360778010323,12411,242,195,5,11,南,10.0
122,天心南郊公园猴子石路128号湘江锦绣,112.96225198094146,28.14759377461155,9214,91.8,99.64,3,7,南北,11.0
123,雨花井湾子洞井中路411号园康星都荟,113.01417071806867,28.132536466082232,12264,132,107.64,4,8,南,8.0
124,天心省政府万家丽南路1288号御邦,112.99182190456739,28.061471525795564,12554,218,173.66,5,10,南北,14.0
125,"望城普瑞大道西普瑞大道,近沿河路澳海望洲府",112.85035851211578,28.29824447261247,6245,68,108.9,3,7,南,6.0
126,开福北辰三角洲湘江北路三段1200号北辰三角洲奥城E4区,112.97801855846504,28.23607052313812,17224,185,107.41,3,6,南北,5.0
127,"天心暮云万家丽南路,近金海路丽发新城",113.01458159758431,28.064522781702408,7344,60,81.7,2,5,南北,6.0
128,天心友谊路新韶东路168号鑫远湘府华城(北区),112.98411712774916,28.125340449560365,10027,141.9,141.53,3,7,南北,14.0
129,岳麓梅溪湖北麓云路268号梅溪湖金茂悦(一二期),112.88501200891383,28.198146132115482,16039,183,114.1,3,7,南北,8.0
130,雨花雨花区政府圭塘路264号香樟鑫都,113.02211718097944,28.13919347821303,9683,132,136.33,3,7,南,11.0
131,岳麓洋湖湿地公园潇湘南路一段508号湘熙水郡,112.92232523185505,28.12961884091196,12482,118,94.54,3,7,南,6.0
132,开福北辰三角洲黄兴北路北辰三角洲E6,112.97685152652947,28.234532419537114,18973,275,144.95,4,8,南北,6.0
133,岳麓洋湖湿地公园学士路江山帝景哈佛,112.92232523185505,28.12961884091196,10683,102,95.48,3,6,南北,2.0
134,岳麓梅溪湖北沐风路19号梅溪青秀(一期),112.86886213140295,28.191636267984155,12849,119.8,93.24,3,6,南北,7.0
135,"望城月亮岛普瑞大道,近银杉路万润滨江天著",112.9190242578526,28.299370918044225,10648,111.8,105,3,7,南,5.0
136,雨花红星万家丽中路399号翡翠云天,113.03676564223406,28.11049188984474,10448,142.8,136.68,4,8,南,10.0
137,雨花雨花区政府圭塘路650号德润小区(北区),113.02281484793637,28.12440456131471,12633,155.8,123.33,3,7,南,9.0
138,岳麓银盆岭银双路120号兰亭都荟,112.94225010017794,28.22604548479253,14435,203,140.64,4,9,南,10.0
139,"望城月亮岛月亮岛路,近银杉路润和滨江府(一期)",112.92048341866173,28.29252639165686,10892,110,101,3,7,南,5.0
140,"开福四方坪东二环,近栖凤路海洋半岛",113.01644007270777,28.241087194884546,10699,95,88.8,3,6,南,10.0
141,天心省政府湘府西路229号保利花园,112.96589944627026,28.11270634319214,9423,102,108.25,3,7,南北,11.0
142,雨花红星圭塘路五矿万境水岸嘉苑,113.02206741498686,28.118184496983872,12486,115,92.11,3,7,南北,9.0
143,星沙星沙大道星沙大道198号蓝山郡,113.0819171833012,28.25677904054492,7610,98,128.79,3,7,南北,10.0
144,岳麓洋湖湿地公园福祥路109号北大资源理想家园,112.93988817496223,28.126994504416228,12286,110,89.54,3,6,南,7.0
145,开福湘江世纪城湘江北路湘江世纪城鸿江苑,112.9713473471915,28.26827246893489,10637,165,155.12,4,8,南北,15.0
146,岳麓银盆岭银盆岭路228号保利西海岸(A区),112.95568269367456,28.22547153941616,16814,220,130.85,4,8,南北,5.0
147,雨花高桥万家丽中路一段275号金地格林公馆,113.0264252250541,28.18147605896486,10370,118,113.8,3,7,南北,5.0
148,望城普瑞大道西雷锋大道金地三千府(别墅),112.86952743228989,28.277890897880948,13147,188,143,3,8,南北,9.0
149,望城金星北银星路555号龙湖湘风原著,112.90804011862816,28.280010048669986,9984,119.8,120,4,8,南,6.0
150,芙蓉芙蓉车站北路车站北路70号万象新天,113.00657423141034,28.203824565773225,12373,150,121.24,3,7,南,15.0
151,雨花红星圭塘路774号德润小区(南区),113.02048865390096,28.119940481608275,12518,190,151.79,4,8,南,9.0
152,雨花阿弥岭港岛路22号朝阳欣园,113.00085293046821,28.186106010716852,11572,145.8,126,3,7,南,21.0
153,天心天心区政府中意一路1068号长城水郡,112.99365826038199,28.09429352989691,11730,118,100.6,3,7,南北,11.0
154,"岳麓洋湖湿地公园潇湘南大道,近虹山路蓝光雍锦半岛",112.92232523185505,28.12961884091196,9989,128,128.15,3,7,南北,7.0
155,星沙泉塘东六路137号未来蜂巢,113.10506238906449,28.220210935159045,7317,57.8,79,3,6,南北,6.0
156,望城普瑞大道普瑞大道恒大名都,112.90469530591072,28.2997457948747,6043,80,132.39,3,7,南北,9.0
157,"星沙开元路星沙开元路,近东九路旭辉美的东樾城",113.12591078897913,28.251987203494924,10239,129,126,4,8,南北,6.0
158,岳麓咸嘉湖金星中路288号西子湖畔沃府,112.93018418459447,28.214140746044038,9495,142,149.56,4,8,南北,12.0
159,开福山语城新安路湘诚德峰小区(B区),112.95036094768757,28.313177401158004,8562,106.8,124.74,3,7,南,8.0
160,岳麓桐梓坡西路雷高路山水梅溪雅郡,112.83763336994424,28.216759803001644,8802,126.8,144.07,4,8,南北,4.0
161,望城金星北潇湘北路润和湘江天地(一期),112.92813698577814,28.291238688724658,11636,150,128.92,4,7,南,4.0
162,"岳麓观沙岭观沙岭路,近含光路龙湖春江郦城",112.94850641655474,28.242330826625263,20347,270,132.7,3,7,南北,3.0
163,岳麓大学城潇湘中路355号万科金域缇香,112.94494505267873,28.151161223280628,12920,126,97.53,3,7,南北,7.0
164,"星沙泉塘东六路,近社塘路中国铁建国际城(二期)",113.11002378216418,28.23535088695554,8057,68,84.4,3,6,南北,6.0
165,"望城普瑞东路月亮岛路,近谷山路三润城",112.89296237537162,28.29097264638015,8246,106,128.56,4,8,南,2.0
166,望城月亮岛月亮岛路润和滨江府(二期),112.91695981884419,28.290257196494938,11920,118,99,3,6,南,7.0
167,开福伍家岭芙蓉北路二段200号明珠苑,112.98209334438837,28.233635115923544,10659,125,117.28,3,7,南北,12.0
168,芙蓉万家丽马王堆中路79号东玺门,113.02155394447573,28.19702539397576,8715,77.8,89.28,2,5,南,11.0
169,岳麓含浦学士路99号江山帝景雅典,112.90030545306516,28.132055020935827,8669,130,149.97,3,7,南,12.0
170,开福开福周边太阳山路1号卓越青竹湖,112.96658026509466,28.337975658180227,8527,105,123.14,3,7,南,4.0
171,雨花左家塘妹子山巷28号曙光领峰,112.99921218544166,28.183977837773412,11882,150,126.25,4,8,南北,14.0
172,"开福开福周边芙蓉北路,近高冲路新城和樾",112.95031393480892,28.32032343924323,7758,105,135.35,4,8,南北,4.0
173,"天心新省政府南雀园路,近石碑路九峰远见",112.97302471360895,28.09925460948027,12845,149,116,3,7,南北,8.0
174,天心友谊路林大路(旧:友谊路268号)万芙锦城,112.99089571488527,28.129060485075833,11820,128,108.3,3,7,南北,13.0
175,望城金星北银杉路润和湘江天地(C区),112.92721916071538,28.290495905924445,10460,115,109.95,3,6,南,4.0
176,芙蓉朝阳路朝阳路78号凯通国际城,113.00286704771695,28.190779000425284,11191,126,112.6,4,8,南北,14.0
177,望城普瑞大道西雷锋大道金地三千府,112.86952743228989,28.277890897880948,9208,122,132.5,4,8,南北,7.0
178,"望城月亮岛金星北路,近月亮岛路明发国际城",112.91574377489384,28.29158856875385,9958,98,98.42,3,7,南北,9.0
179,岳麓梅溪湖南环湖路488号佳兆业云顶梅溪湖(一二期),112.88929825210927,28.179788475011062,13607,150,110.24,3,7,南,9.0
180,雨花东塘水电街31号(旧:韶山路62号)湘农桥社区(二区),112.9869183497455,28.178568072862063,11863,99.8,84.13,3,5,南北,28.0
181,"望城普瑞大道黄金东路,近普瑞大道润和紫郡",112.89900786383119,28.295438311191635,8803,109,123.83,4,8,南,10.0
182,岳麓枫林一路枫林一路737号共和世家,112.92663000115756,28.206361774843003,12983,165,127.09,3,7,南北,14.0
183,岳麓湖南财专金星南路29号中一九骏,112.91538724076428,28.20438920881855,11603,102,87.91,3,6,南北,10.0
184,岳麓麓谷岳麓大道潇湘奥林匹克花园(二期),112.86783751227438,28.233928500462913,11964,113.8,95.12,3,6,南北,8.0
185,天心友阿奥特莱斯芙蓉南路二段229号中建芙蓉嘉苑(南区),112.98652202718279,28.084774342077804,11987,105,87.6,3,6,南北,9.0
186,天心铁道学院新柠路1号柠檬丽都,112.97801974934141,28.13437690832171,10060,128.8,128.04,3,7,南北,14.0
187,开福四方坪东二环二段562号鑫利家园,113.0139604658886,28.23322546676189,9052,105,116,3,7,南北,5.0
188,岳麓阳光100后湖路阳光100国际新城(西区),112.9335190749361,28.14488216162456,9129,128,140.22,3,7,南,10.0
189,望城金星北银星路999号澳海澜庭,112.89981963289368,28.283160879401866,7957,79.8,100.29,3,7,南,2.0
190,雨花万家丽南路万家丽南路二段112号绿地新都会,113.02565173590524,28.07642540498776,10313,108,104.73,3,7,南北,6.0
191,开福开福周边鹅秀路万境潇湘,112.94443637732132,28.309706208626523,13098,183,139.72,4,8,南北,4.0
192,"天心奥特莱斯广场芙蓉南路,近披塘路鑫远悦城",112.98371962476863,28.086386926865984,9987,122,122.16,3,7,南北,5.0
193,雨花韶山南路韶山南路633号上海城,112.99822887462685,28.134314980617955,12383,138,111.45,3,7,南,12.0
194,岳麓洋湖湿地公园中央大道合能洋湖公馆(一期),112.9357882903129,28.134403395415223,12833,102.8,80.11,3,6,南北,9.0
195,天心省政府杉木冲中路236号润屋美院,112.98554314250303,28.112372176592473,12839,108,84.12,3,6,南北,5.0
196,星沙泉塘黄兴大道东方美地,113.12332274073779,28.20159488430304,8124,78.8,97,3,7,南北,8.0
197,开福北辰三角洲湘江北路三段1200号北辰三角洲奥城C2区,112.97877515315362,28.242322176649452,15187,180,118.53,3,7,南北,5.0
198,"天心天心区政府园艺路,近芙蓉南路兴汝金城",112.98417227982337,28.117732736440512,12909,168,130.15,4,8,南北,10.0
199,岳麓枫林三路正兴路118号荷塘月色(岳麓),112.84451028543208,28.206263738965475,8088,95,117.46,3,7,南北,10.0
200,"开福山语城芙蓉北路,近高冲路恒大御景天下",112.94682546040109,28.31602869097084,8271,88,106.4,3,6,南,2.0
201,星沙开元路东六路266号华润置地广场(一期),113.10717985847923,28.24992178587383,8207,71.8,87.49,3,6,南北,10.0
202,天心省政府书香路756号东能华府,112.97746041506751,28.119346676361268,10008,139,138.89,4,8,南北,7.0
203,天心芙蓉南路刘家冲南路599号碧桂园城市花园(天心),112.9865101094635,28.096335580490656,12321,138,112.01,3,7,南北,8.0
204,"岳麓梅溪湖北梅溪湖路,近梧桐路时代梅溪领峰",112.87477588412696,28.18149642778848,14344,210,146.41,4,8,南北,3.0
205,"雨花雨花区政府体院路,近白冶路合能枫丹丽舍",113.04137297242231,28.128001448025028,10035,100.8,100.45,3,7,南北,5.0
